{
 "format": "paper_scene/1",
 "id": "paper-factory",
 "title": "The paper factory",
 "brief": "A 20-second paper-cut animation, vertical 1080x1920, no narration, no text: a tiny paper factory that makes evening suns. Three workers in yellow helmets: one in blue overalls (background, by the crane controls), one in red overalls (left), one in green overalls with a mustache (right). A shutter opens and a sun is rolled out along the conveyor; the sky is painted band by band; the crane hooks the sun and lifts it into the sky; the workers admire it. Then the green worker, stepping back in excitement, bumps the crate: the jar of stars standing on it wobbles and falls on HIS side. The stars burst out of the jar, scatter across the sky, and night falls. The workers look at each other, then shrug.",
 "duration": 20.0,
 "layouts": {
  "portrait": {
   "aspect": "9:16",
   "width": 1080,
   "height": 1920,
   "ui_safe_bottom": 0
  }
 },
 "style": {
  "background": "#e8e0cf",
  "grain": true,
  "grain_seed": 7,
  "grain_alpha": 0.55,
  "vignette": true,
  "fade_in": 0.45
 },
 "order": [
  "blank_page",
  "pencil_1",
  "pencil_2",
  "pencil_3",
  "pencil_4",
  "pencil_5",
  "pencil_6",
  "pencil_7",
  "sky",
  "night_sky",
  "hill_far",
  "hill_near",
  "back_floor",
  "lever",
  "lever_box",
  "bay",
  "lamp_light",
  "lamp",
  "chimney",
  "smoke",
  "w_blue",
  "sun",
  "factory",
  "roof_1",
  "roof_window_1",
  "roof_2",
  "roof_window_2",
  "roof_3",
  "roof_window_3",
  "bricks",
  "window_glow_1",
  "window_rim_1",
  "window_1",
  "window_glow_2",
  "window_rim_2",
  "window_2",
  "gear",
  "sign",
  "shutter",
  "conveyor",
  "crane",
  "grass_1",
  "grass_2",
  "flowers",
  "w_red",
  "pole",
  "crate",
  "jar",
  "w_green",
  "night",
  "stars"
 ],
 "props": [
  {
   "id": "blank_page",
   "type": "shape",
   "params": {
    "shape": "rect",
    "rect": [
     -40,
     -40,
     1160,
     2000
    ],
    "color": "#e8e0cf",
    "shadow": false,
    "edge": false
   }
  },
  {
   "id": "pencil_1",
   "type": "path",
   "params": {
    "points": [
     [
      70,
      120
     ],
     [
      1010,
      123
     ]
    ],
    "color": "#8c8073",
    "width": 1.2,
    "line_alpha": 0.1
   }
  },
  {
   "id": "pencil_2",
   "type": "path",
   "params": {
    "points": [
     [
      70,
      310
     ],
     [
      1010,
      313
     ]
    ],
    "color": "#8c8073",
    "width": 1.2,
    "line_alpha": 0.1
   }
  },
  {
   "id": "pencil_3",
   "type": "path",
   "params": {
    "points": [
     [
      70,
      500
     ],
     [
      1010,
      503
     ]
    ],
    "color": "#8c8073",
    "width": 1.2,
    "line_alpha": 0.1
   }
  },
  {
   "id": "pencil_4",
   "type": "path",
   "params": {
    "points": [
     [
      70,
      690
     ],
     [
      1010,
      693
     ]
    ],
    "color": "#8c8073",
    "width": 1.2,
    "line_alpha": 0.1
   }
  },
  {
   "id": "pencil_5",
   "type": "path",
   "params": {
    "points": [
     [
      70,
      880
     ],
     [
      1010,
      883
     ]
    ],
    "color": "#8c8073",
    "width": 1.2,
    "line_alpha": 0.1
   }
  },
  {
   "id": "pencil_6",
   "type": "path",
   "params": {
    "points": [
     [
      70,
      1070
     ],
     [
      1010,
      1073
     ]
    ],
    "color": "#8c8073",
    "width": 1.2,
    "line_alpha": 0.1
   }
  },
  {
   "id": "pencil_7",
   "type": "path",
   "params": {
    "points": [
     [
      70,
      1260
     ],
     [
      1010,
      1263
     ]
    ],
    "color": "#8c8073",
    "width": 1.2,
    "line_alpha": 0.1
   }
  },
  {
   "id": "sky",
   "type": "bands",
   "params": {
    "colors": [
     "#f7bd45",
     "#f39a3c",
     "#ef7360",
     "#e7678f",
     "#c56a9f",
     "#8f6fb1"
    ],
    "top0": 1330,
    "band_h": 222,
    "overlap": 14,
    "strokes": 9
   }
  },
  {
   "id": "night_sky",
   "type": "curtain",
   "params": {
    "top": "#1d2150",
    "bottom": "#3b3f7e"
   }
  },
  {
   "id": "hill_far",
   "type": "shape",
   "params": {
    "shape": "poly",
    "points": [
     [
      -20,
      1480
     ],
     [
      -20,
      1271.33
     ],
     [
      40,
      1243.72
     ],
     [
      100,
      1223.59
     ],
     [
      160,
      1216.62
     ],
     [
      220,
      1224.1
     ],
     [
      280,
      1242.49
     ],
     [
      340,
      1265.0
     ],
     [
      400,
      1284.38
     ],
     [
      460,
      1295.84
     ],
     [
      520,
      1298.84
     ],
     [
      580,
      1296.91
     ],
     [
      640,
      1295.82
     ],
     [
      700,
      1300.65
     ],
     [
      760,
      1313.27
     ],
     [
      820,
      1331.21
     ],
     [
      880,
      1348.49
     ],
     [
      940,
      1358.03
     ],
     [
      1000,
      1354.65
     ],
     [
      1060,
      1337.42
     ],
     [
      1120,
      1310.18
     ],
     [
      1100,
      1480
     ]
    ],
    "amp": 3,
    "step": 20,
    "color": "#a9b98d",
    "depth": 1.2
   }
  },
  {
   "id": "hill_near",
   "type": "shape",
   "params": {
    "shape": "poly",
    "points": [
     [
      -20,
      1480
     ],
     [
      -20,
      1338.2
     ],
     [
      30,
      1332.58
     ],
     [
      80,
      1335.47
     ],
     [
      130,
      1351.09
     ],
     [
      180,
      1375.16
     ],
     [
      230,
      1397.5
     ],
     [
      280,
      1409.03
     ],
     [
      330,
      1408.02
     ],
     [
      380,
      1400.68
     ],
     [
      430,
      1395.9
     ],
     [
      480,
      1398.04
     ],
     [
      530,
      1403.53
     ],
     [
      580,
      1403.79
     ],
     [
      630,
      1392.28
     ],
     [
      680,
      1370.15
     ],
     [
      730,
      1346.1
     ],
     [
      780,
      1330.5
     ],
     [
      830,
      1328.15
     ],
     [
      880,
      1335.31
     ],
     [
      930,
      1343.12
     ],
     [
      980,
      1344.73
     ],
     [
      1030,
      1340.69
     ],
     [
      1080,
      1338.34
     ],
     [
      1100,
      1480
     ]
    ],
    "amp": 3,
    "step": 20,
    "color": "#8eab73",
    "depth": 1.2
   }
  },
  {
   "id": "back_floor",
   "type": "shape",
   "params": {
    "shape": "rect",
    "rect": [
     -20,
     1476,
     1120,
     120
    ],
    "amp": 2.5,
    "color": "#d2b98e",
    "depth": 1.0
   }
  },
  {
   "id": "lever",
   "type": "group",
   "at": [
    860,
    1436
   ],
   "params": {
    "children": [
     {
      "shape": "rect",
      "rect": [
       -3,
       -26,
       6,
       28
      ],
      "amp": 0.4,
      "color": "#3b3437",
      "depth": 0.4,
      "key": "lever_stick"
     },
     {
      "shape": "circle",
      "r": 6,
      "color": "#e2553f",
      "depth": 0.4,
      "key": "lever_knob"
     }
    ]
   },
   "anchors": {
    "handle": [
     0,
     -26
    ]
   },
   "init": {
    "rot": -0.3
   }
  },
  {
   "id": "lever_box",
   "type": "shape",
   "at": [
    860,
    1480
   ],
   "params": {
    "shape": "rect",
    "rect": [
     -18,
     -46,
     36,
     46
    ],
    "amp": 0.8,
    "color": "#5d5f68",
    "depth": 0.8
   }
  },
  {
   "id": "bay",
   "type": "shape",
   "params": {
    "shape": "rect",
    "rect": [
     230,
     1218,
     222,
     264
    ],
    "color": "#4c302b",
    "shadow": false
   }
  },
  {
   "id": "lamp_light",
   "type": "shape",
   "params": {
    "shape": "poly",
    "points": [
     [
      340,
      1235
     ],
     [
      270,
      1480
     ],
     [
      420,
      1480
     ]
    ],
    "color": "#f6c76a",
    "alpha": 0.25,
    "edge": false,
    "shadow": false,
    "amp": 0
   }
  },
  {
   "id": "lamp",
   "type": "shape",
   "at": [
    340,
    1232
   ],
   "params": {
    "shape": "ellipse",
    "rx": 16,
    "ry": 8,
    "color": "#2f2a2a",
    "depth": 0.5
   }
  },
  {
   "id": "chimney",
   "type": "group",
   "params": {
    "children": [
     {
      "shape": "rect",
      "rect": [
       82,
       960,
       58,
       190
      ],
      "amp": 1.2,
      "color": "#b5523c",
      "depth": 1.0
     },
     {
      "shape": "rect",
      "rect": [
       78,
       980,
       66,
       14
      ],
      "amp": 1,
      "color": "#f2e6cf",
      "depth": 0.4
     },
     {
      "shape": "rect",
      "rect": [
       78,
       1040,
       66,
       14
      ],
      "amp": 1,
      "color": "#f2e6cf",
      "depth": 0.4
     }
    ]
   }
  },
  {
   "id": "smoke",
   "type": "smoke",
   "at": [
    111,
    940
   ]
  },
  {
   "id": "sun",
   "type": "sun",
   "at": [
    325,
    1345
   ],
   "params": {
    "r": 95
   }
  },
  {
   "id": "factory",
   "type": "shape",
   "params": {
    "shape": "poly",
    "points": [
     [
      30,
      1120
     ],
     [
      452,
      1120
     ],
     [
      452,
      1220
     ],
     [
      230,
      1220
     ],
     [
      230,
      1480
     ],
     [
      30,
      1480
     ]
    ],
    "amp": 1.6,
    "color": "#d8694b",
    "depth": 1.3
   }
  },
  {
   "id": "roof_1",
   "type": "shape",
   "params": {
    "shape": "poly",
    "points": [
     [
      26,
      1124
     ],
     [
      52,
      1052
     ],
     [
      175,
      1124
     ]
    ],
    "amp": 1.5,
    "color": "#8a4a3d",
    "depth": 1.0
   }
  },
  {
   "id": "roof_window_1",
   "type": "shape",
   "params": {
    "shape": "poly",
    "points": [
     [
      36,
      1118
     ],
     [
      54,
      1068
     ],
     [
      64,
      1118
     ]
    ],
    "amp": 0.8,
    "color": "#c8d7d6",
    "depth": 0.2
   }
  },
  {
   "id": "roof_2",
   "type": "shape",
   "params": {
    "shape": "poly",
    "points": [
     [
      167,
      1124
     ],
     [
      193,
      1052
     ],
     [
      316,
      1124
     ]
    ],
    "amp": 1.5,
    "color": "#8a4a3d",
    "depth": 1.0
   }
  },
  {
   "id": "roof_window_2",
   "type": "shape",
   "params": {